heading,review
" Reclaiming Your Life","Telling parallel stories inter-related to various degrees had been the flavor for some time now in Hindi cinema. Success, however, is almost absent. Anurag Basu had almost pulled it off except for three things - incorrect branding, lack of originality and wannabe rock stars showing up everywhere.The story as such had nothing to do with the city of Mumbai. It could have been set anywhere. Also how the city adds to the plights and joys of the character is not very clear. Rat race, lack of time for family, sexual confusions/frustrations are all a reality today of even mid-range cities, not only metros. This is what I meant by incorrect branding. I think the film should have been promoted as story of the time we live in, irrespective of the city. It would have appealed to a larger audience base.Basu has been liberal in copying the classic 'The Apartment'. You cannot copy a classic just like that. I'm not sure if the makers of 'The Apartment' are at least credited. Originality is the biggest virtue of any art. Then, the rock stars. Pritam and his band were omnipresent throughout the film. The songs are fantastic but they popping up everywhere started to irritate very soon. A more imaginative filming of the songs would have added to the film's value.Inspite of all this, Metro is a very good film to come out in recent times. Though Basu does not go deep into the torments of the characters and just touches them fleetingly, he does manage to capture the essence. Casting is almost precise and all actors do a good job. You get the import of the film that how we are losing ourselves in the maze of the paths laid down for us by everyone except ourselves. It is hard to stand up and reclaim your life. It is difficult to open the car's door and walk out like Kangana does at the end, but probably that's what most of us want to do most of the time." 
" A little over ambitious?","The screening of this Indian film I saw was not the final cut and didn't have the final soundtrack, nor did it feature any background noise. Saying then that this is a review of the film is not 100% correct, but I'll give you an impression of what I did see. Hovering in a genre caught between traditional Bollywood and cinema as we know it in the West, Metro tries to appeal to a wide audience. The trouble is I can imagine it alienating Indian viewers with it's discussion of sex and lust, infidelity and corruption- while repelling western audiences because most of this serious film is laughable. It's not unknown that Bollywood and Hollywood have different ideas about what makes a good film, so at any of the many many points in the film when the three-man band come into shot and start wailing while the foreground displays a montage of characters' situations it becomes ever harder to take the film seriously. So much so that it was excruciating for occupants of the screening room to try to quell our laughter. Shilpa Shetty is this film's most well known actor outside of India, but her acting here doesn't support the fame she found through Celebrity Big Brother, and of the rest of the cast, only Sharman Joshi puts in a notable performance. Anurag Basu certainly doesn't lack ambition (this is the first Indian film to achieve a Leicester Square premier, even if it is on a Tuesday evening while the cinema is being refurbished and without any movie posters) but I have an inkling that the film will be lost on non-Asian audiences." 
" Watch 'The Apartment' instead!","Well. What's life in a Metro all about? Its all about survival; a race to win at any cost and not a morning walk. There are extra-marital affairs, bride and bridegroom hunters, wives who sacrifice their future for family welfare, struggling artists, just to name a few, and the movie provides a taste of these experiences with its star cast..The main essence of the movie is a direct lift from the 1960 classic movie 'The Apartment.' Here a Jack Lemmon gets replaced by Sharman Joshi, and his boss Fred MacMurray is played by Kay Kay Menon. Rest of the sub plots get drowned with regular bollywood masala and never get in sync with the message the movie is trying to deliver.The movie lacks the finesse and treatment of 'The Apartment,' which even today is rated among the best adult comedy made for its time. On this count, Life in a Metro fails miserably since it treats a mature subject with an amateur outlook. At times its difficult to classify the movie as a romance, drama or a screwball comedy. For teasers: How about riding your wedding horse on a crowded Mumbai railway platform where humans cannot get by without a snug fit.Performances by Kay Kay Menon, Sharman Joshi, Irfan Khan, Konkona Sen Sharma stand out, the rest including celebrity big brother star Shilpa Shetty simply fade as the movie progresses. Dharmendra chooses the wrong vehicle to make his comeback, since he waltzes to a role of which he has no inkling. Cant blame him for having that 'lost look,' while playing his part.The movie is relevant to its times and showcases the change in Indian cinema, but the portrayal could have been much better. The soundtrack provides a refreshing change with guitar strings complimenting a few soulful numbers. But after a while, the repeated presence of the singers turns from innovative to frustrating and its better to enjoy the music keeping your eyes shut. The movie might appeal to those who have not seen the original, but for those who wish to watch meaningful cinema  rent a DVD of 'The Apartment,' to watch at home instead." 
" an amalgamation of six stories between nine characters from one suburb","With one movie, Anurag Basu rose quite high in my books as a director to look out for. Gangster was in many ways a complete movie for an Indian Movie audience and one of the best features of last year. Expectantly, Life in a... Metro was highly anticipated, especially with the movie repeating most of Basu cast & crew and a few more welcome actors. Basu sits right on top of the breed of Bhatt-nurtured directors who, if nothing else, have always made movies distinctly different from regular Bollywood fare.Life in a... Metro is an amalgamation of six stories between nine characters from one suburb. These stories entwine and intersect at various points to portray personal lives for regular middle-class suburb dwellers. Passion, Sex, Loyalty, Romance, Lust, Stress and Love become the underlying themes woven into the fabric of the movie.Basu is not in top form here, but this could be more due to constraints of mainstream Bollywood. Visibly a bigger and a more conformist producer like UTV (Ronnie Screwwala) is not as liberal as the Bhatts with Basu. Melodrama and formula somehow creep in and take over the final act of the movie in a complete departure of style from the rest of the movie. Apart from this major gripe, Basu deftly handles interspersing between stories and fleshing out his characters. Adultery becomes a major theme in most of the stories, but moral questions are not raised and neither ignored. Events are simply depicted "as is", letting the viewer judge for him/herself of their moral implications. That extra-marital affairs and sex-for-favors exist is taken as fact rather than implied, taboo'd or endorsed. Rather, the effect of it on individuals is depicted differently and quite aptly. Among the troupe of (mostly) wonderful actors, Kay Kay Menon thunders ahead portraying a selfish and chauvinistic husband and boss. Any scenes with him are the highlights of the movie proving again beyond doubt how wonderful an actor he is, regardless of the character he plays. Yet, for the genuinety of him you are left wanting to see more of him on screen than the limited screen time the director could afford. Complementing him in a parallel story is Irrfan, an equally gifted actor, playing a passionate and philosophical middle-age single guy looking for an ideal wife through matrimonial ads. Sprinkle around them a host of characters to support their stories, and you have a wonderful ensemble that is as true to the setup of the movie as any. Shiny Ahuja and Kanga Ranaut play easy parts but their talents are used only to a minimum. Dharmendra, Nafisa Ali, Sharman Joshi and Konkona Sen Sharma play regulars. Exception: Shilpa Shetty. Her character and performance are so out of this movie that you wonder if she walked into the wrong movie set with a different script. Shamelessly flaunting her star status and new-found celebrity, she proves yet again that being and "Actor" and a "Movie Star" are not mutually inclusive.Basu's association with Pritam continues to produce some really good music. The movie's music is more of a soundtrack with a single musical theme in all the tracks. Basu also has the three-member band appear throughout the movie inbetween and during scenes. These band members are part of the crowd, or drifters singing the tracks that are sprinkled through the movie. A high-end concept for Indian Cinema, and one that works for me completely.Although the climax reaches levels of extreme campyness, it is easy to forgive the director for the battle he fights with only a few others on his side against Bollywood conventionalism. Yet, after the powerful Gangster, Basu's latest is a step down. For his and our sake, I wish him back to the Bhatts.My Rating --> 3.5 of 5" 
" slick, chic and very watchable!!","i just came back after seeing the movie and couldn't help writing something (good) about it. after a series of disappointing Hindi and a few English (spiderman 3)this one was totally refreshing. but as i logged on to the site i saw someone saying that it seemed like a half hearted effort to him.firstly, he seemed to have been too influenced with the sharman joshi n the apartment bit. that was only a small part of the film n not the main story. i agree to his viewpoint that some of these stories did seem familiar and seen before but i would say that they were handled and presented in a much better way in this movie.secondly, most of the Indian directors fail to manage parallel stories like this one but it's been done sensitively here. the movie has it's weak points too, but VERY few. all the characters were well defined, no extra footage to anyone in particular, the story has a few unpredictable sequences and YES the horse on the roads of mumbai was dramatic but haven't we grown up seeing just all of this in most of the other Hindi movies. at least it was done in a more fun way.not to mention that konkona was immense! (does she ever do any bad movies???) irrfan khan was fantastic, shilpa shetty wasn't too bad as well. i really liked gangster and unlike the other first-time-wonder directors, anurag basu does a fantastic job the second time around.it's totally watchable and love irfan n konkona's chemistry!!!" 
" Neither here nor there","The movie does not get into any subject in depth.There could have been more humor because the movie doesn't involve you intellectually nor does it move your heart.I kept waiting for more, just too little and it does disappoint.There was no need to deal with homosexuality(it does not help the story line in anyway). There was no need for dharmender to do such a role (he has lost his voice).Acting is fine. The songs do get monotonous.I wish it was a direct copy of the "Apartment" with some extra comedy. That would have made it a much better movie than what it is now." 
