heading,review
" A Nutshell Review: Once Upon a Time in Mumbaai","You can probably name a number of films with titles "Once Upon a Time in..." where we go back in time to eras in cities or countries past, with room for plenty of astounding stories to be told, complete with that nostalgic peek in a time long gone. In Once Upon a Time in Mumbaai, writer Rajat Arora and director Milan Luthria bring us back to the 60s to 80s Mumbai, with the city having to taste the onslaught of the Mafia operating from within, carefully carving territories amongst themselves so that they can each operate in their own spheres of influence as mooted by a certain Sultan Mirza (Ajay Devgan), with him forsaking land to his peers and opting for control over the sea routes for his smuggling activities.So begins the tale of a much respected gangster, well known throughout the city for his no- nonsense approach and honour amongst thieves, yet possessing that heart of gold and compassion in his willingness to help impoverished folks where the authorities can't, himself having started from an almost impossibly poor beginning and working his way up through a variety of con jobs. But one gangster alone doesn't make this the blast from the past tale it got touted to be, with the story enveloping two other key characters, with Shoaib Khan (Emraan Hashmi of Tum Mile) the protégé gangster wannabe who looks toward Sultan as a source of inspiration, but possesses a hungrier and larger ambition and an obsession to emulate his idol, and on the other side of the law, ACP Agnel Wilson (Randeep Hooda) who at first thought that taming the city will be a piece of cake, but soon finds himself embroiled in a battle larger than what he alone thought could handle.It is the intertwining of the lives of these three characters that propel the narrative forward, with the two gangster characters Sultan and Shoaib finding parallels with real life mobsters Haji Mastan and Dawood Ibrahim who reigned over the Mumbai underworld during the same era. It charts their respective path to infamy, with each having to take a different route and approach in terms of what morals they are willing to compromise in their grip for power and ownership of the city, with Mumbai herself becoming that object of desire. The story takes pains to tell how each possesses a certain amount of ingenuity in their dealings as gangsters to make up for the lack of action sequences, while also highlighting their differences that will eventually see them cross paths into foes, with the police willing to take a backseat to see how it will all play out.As with a typical Hindi film, romance is never left far behind, and ample time is given to mirror the kind of relationships each man develop with their lady love. Kangana Ranaut glams up for her role as the superstar actress Rihana who sweeps and got swept off the floor by Sultan in their fairy tale like whirlwind romance, while that between Shoaib and Mumtaz (Prachi Desai) is almost the exact opposite with a more down to earth relationship riddled with issues since Mumtaz cannot reconcile Shoaib's desire to rise to the top through whatever means possible. Worst of course come the humiliation that Shoaib's initial failure bring about, and that uncontrollable dogged temper that sees him never wanting to get stuck back in the rut again.So we have a clear distinction before and after the interval, beginning with the measured setting of the pace for the introduction of all the key characters and their respective rise to power, and after that the beginnings of true rivalry formed. Ajay Devgan comes hot off the successful Rajneeti, and his growing screen charisma is never beyond doubt as he chews up each scene he's in. He brings a non-threatening Sultan when he's with the poor masses, and switches to bad-ass routine with ease when he finds himself crossed and betrayed. Emraan Hashmi too holds his own against the heavyweight actor, and his emulation in wanting to be Sultan goes well thanks in part to the costume designers, who work wonders in decking all of them in retro garb, and credit too to making Kangana Ranaut quite the clotheshorse here, whose character unfortunately got forgotten midway.Randeep Hooda perhaps got the role that elicit the most laughter, because his ACP Agnel has a penchant of speaking through idioms, which of course in a way exaggerates speech. Being a non-Hindi speaker, I'm definite some meanings got lost in translation, but I got the idea since the filmmakers tried their best to bring this sense of stiff, unbelievable dialogue through to the subtitles. In some ways, the look and feel of the film was hyper-realistic, alluding to how certain elements got deliberately fictionalized beyond reality through stylized sequences. The main electric guitar riffs for the theme will also become that ear worm long after the film ends, and got used to perfect glee when it comes on to accompany a swagger or two.Beginning in the 90s and having the story told in flashback by ASP Agnel, unfortunately audiences will find being left high and dry when the story ends, with plenty of narrative room for another film that will bring us full circle to how it all started. A lot of questions still remain given the events in the last 5 minutes of the film, and this will only, and possibly be addressed should a follow up be made. Otherwise we'll left with quite the cliffhanger, though this isn't reason enough why you should stay away from it. An arresting storyline with a competent cast delivering their roles with aplomb still makes this quite the blast from the past trip worthwhile, with Ajay Devgan continuing to show he can hold down that leading man status." 
" What a poetic movie!!","I had this movie in my watch list for almost a year! I finally watched it! I am glad I DID!. The characters, chemistry between each of them, acting, cinematography, everything is amazing. BUT the most importantly the poetic dialogues are really amazing and so delicious to listen. Ajay Devgan top 5 movies!Hats off!" 
" Evil...with a heart of gold.",""Once Upon a Time in Mumbai" is obviously a film that is trying to capitalize on the success of such classics as "Once Upon a Time in the West" as well as "Once Upon a Time in America" by Sergio Leone. Fortunately, this Indian film is good enough that it's more than just a film borrowing a title!The story begins with a cop trying to kill himself. He survives and then tells the following story about corruption. First, he talks about an anti-hero named Sultan. Sultan is a mobster but he has a very, very strict code of ethics. In his own way, he's a decent fellow and manages to unify all the mobs of Mumbai--bringing them peace and keeping them from selling drugs and destroying the poor. In essence, Sultan is a bad man with a heart of gold.Then the story weaves in the story of Shoaib. Shoaib is almost nothing like Sultan. Instead of being a poor orphan like Sultan, Shoaib was raised by a policeman...but Shoaib is completely amoral, angry and vicious. For a while, Shoaib goes to work for Sultan but, not surprisingly, there's a falling out and I really don't want to tell you more...just see the story.This film has a lot going for it. It's extremely cinematic and well crafted. In particular, I really liked Ajay Devgn (Sultan) as he was a nice combination of power, decency AND corruption--not an easy role to play. Well worth seeing and exciting...though some might dislike the downbeat ending. Considering the characters were based on real mobsters (yes, you can ignore the text at the beginning that says it's all fictional), you can understand the tone of the film at the finale." 
" The Real Stars are the Dialogues","Its an out an out stylish electrifying crime thriller which reminds me of the good old 70's cinema. A movie full of magical background score, powerhouse acting by Devgan and Imran and above all super cool dialogs (listen to them carefully, they are the real winners). The movie portrays rise of smuggler Sultan Mirza (Ajay Devegan) in the Mumbai crime scenario. Sultan is a stylish smuggler who made money by trafficking the contra-bands and used his might to help out the downtrodden. Sultan loves Mumbai and wants it to be clean and for that objective he cuts a deal with other operating crime lords and distributes the areas of Mumbai among themselves so as to bring the inter gang rivalry to an end. Because of his larger than life image, many youngsters start to idolize him and among them is one small time thief, Shoaib (Imran Hashmi).Shoaib is a son of a policeman and does not have much of a future yet wants to reach to the top and live a luxurious life and for that he is ready to anything. Soon he crosses path with Sultan and starts working with him. Soon Shoaib rises in ranks due to his daredevil attitude and a shrewd mind and wins the trust of Sultan. He soon becomes the close confederate of Sultan. Where Sultan had some principles for life, Shoiab has none and thus when Sultan leaves his temporarily leaves his Empire, he entrusts Shoiab with the responsibility.However, because of power and money hungriness of Shoaib and Sultan's never compromising attitude towards certain principles, both head for a showdown.Though loosely based on the lives of legendary smuggler Hazi Mastan and his protégé Daud Ibrahim, this flick takes creative liberty to tell the story with many imaginary sub plots yet the director is able to maintain the realistic feel to the movie. However, the end is bit clichéd but then "who is complaining"!! A worth a watch for the style, panache, background score, decent performances by Huda and Kangna and once again, for its dialogs. So till the next time, "Duaon me yaad rakhna"" 
" Provides wholesome entertainment throughout","After a long time, a movie that manages to entertain throughout its 2 hour+ running time has released in theaters. I went to see this movie in theaters just for the sake of it, but surprisingly, it turned out to be a pleasant and worthwhile experience. The story, screenplay, dialogues, direction, acting, music, etc. were all top notch. Let's start with the performances of the main leads (in order from best to least): 1. Ajay Devgn- Is there any role this man cannot play? His dialogue delivery, costumes, and screen presence were impeccable. He carried the movie brilliantly with his intensity and his ability to show a range of emotions. His performance makes the trip to the theater worth it. 2. Randeep Hooda- Before this movie, I had no idea who he was. I was surprised that he could make his presence felt when he was next to a seasoned, intense performer like Ajay. He delivered his dialogues well and carried himself well throughout the movie. 3. Emraan Hashmi- The serial kisser of the industry surprised me with his performance. He acted very well and was able to make his presence felt. He also showed a great range of emotions.4. Kangana Ranaut- It is a known fact that she has ability to act, but she also looked beautiful. Her chemistry with Ajay was also great. She played her role effectively, although I don't think that this is her BEST performance to date, but certainly one of them. 5. Prachi Desai- She plays her innocent, doting character very well. This is only her third film, yet she can make her presence felt. Out of her 3 films (Rock On, Life Partner, and OUATIM) this was my favorite. Now let's move on to the music by Pritam. All of the songs are great, but "Tum Jo Aaye" is the best for me and is easily one of the best tracks of the year, as well as one of Pritam's best. The soundtrack is one of the best works of Pritam's.The next element is the direction by Milan Luthria. He incorporates Mumbai during the 70s very effectively. This can easily be said to be his finest work to date.People criticize this movie for being "predictable" but where did they get the idea that this movie is of the thriller or mystery genre? It is meant to entertain, which it does very effectively and is one of Bollywood's best crime/mafia movies. Also the violence was not gratuitous, as the fight scenes showed the true violent, psychotic, and dark nature of Shoaib (Emraan's character). So if this is not worth the price of the ticket, then what is?" 
