heading,review
" Beautiful, Excellent, Wild & Passionate Movie","An exceptionally brilliant movie by Mani Ratnam. Impressive performance by all our great artist Vikram (National Award Winner), Abi & Ash. Worth watching in Theaters. Portraying Indian Epic Ramayan in todays world is very artfully and captured in toughest & most picturesque locations in India forest. Once again a blissful music by Academy Winner AR Rehaman(4 National Awards) and admirable cinematography by Santom Sivan(4 National Awards) & Manikandan. Its a new dimension to Indian movie and have raised the bar of Indian Cinema. Its the movie of the year 2010. Vikram playing the dual role of Police Office in Hindi and Raavana in Tamil, the toughest part for an actor to change character every hour during shooting. Raavan is a strong contender for Oscars - Best Foreign Film." 
" From Lallan to Beera.... making of an Actor.","Remember Amrish Puri of 80-90s, as soon as he enters in the scene you start having a nasty feeling of fear, hate and disgust. His cruelty goes within your skin and you abhor him like anything. That's the same terror and nasty sensation Abhishek was able to produce in Raavan. It was Yuva where I saw Abhishek's true potential first time and its Raavan where he shows where he belongs to. Even though Lallan was having kind of negative shades, and Raavan is Villain like hell, but hats off to Maniratnam to bring such a class act out of Abhishek. In entire movie you see and admire him just as an Abhishek, no more papa's boy and no more papa's copy. It was worth every penny to see him grown up as full blown actor. I was so engross with Abhishek's performance that Vikram and Ashwarya, totally justifying there presence were not able to get my attention.Usually when you came out of watching Maniratnam's movie, you found your heart felt tense, your mind ponder heavily, your feet takes smaller steps and your face looks grimmer. While watching Raavan these emotion increases many fold. A totally different experience than how you feel watching Rajkumar Hirani's movie.I think this movie belongs to different genre for different set of audience. It may not be a blockbuster, but this will not change anything about quality of movie. It is pleasant to see that Indian cinema is now a day adventures enough to produce offbeat roles and movies with quality acting and direction. If wanting to relax is not the only criteria you watch movies for then I strongly recommend you this gem. 7.5/10." 
" The 10 HEADS are gripping and intense!","Enough of excitement and curiousness for Raavan ensured a first day,first show ticket with my friends.I was just hoping and praying that it would surmount my expectations and it did.Well almost!What more could you ask for?Aishwarya,Abhi and Vikram in a love triangle with Rahman to tease your ears,Mani to embellish and set the screen on fire.It all made it a deadly combination and be ready to gorge your eyes to a tale narrated like never before.Excellent visuals,witty dialogues,intense acting make Raavan a spectacular experience ought to yearn for.Beera rules the roost and how!10 minutes into the ten heads,you get a whole glimpse into the thick of surroundings.A tough police officer,a gritty follower,a nifty wife,a brutal ' raakshas' and a whole village supporting him.The first hour mostly invades our time to capture the mindset of all these people Beera(Junior B),Raagini(Aishwarya Rai),Dev(Vikram)who form the core and crust of the film.The director doesn't waste much time in conveying the plot of kidnapping Raagini and putting her through immense torture both physically and mentally.Dev,a firm person is determined enough to win back his wife who barely can live without him.The introduction of Hanuman(Govinda) ensures lighter moments in a somewhat serious first half.The latter part concentrates mostly on the cat and mouse chases creating a lively and a nervous atmosphere.With the amazing cinematography,going past the first half is a visual treat to the audiences.Shot in Kerala,the waterfalls,the forests are so full of life and the director uses the locations to his best effect and enhances the beauty of each scene.The second half is where the film scores a lot .The pace quickens unlike the first half and the battle raging between both the sides turns wild and take weird turns keeping the viewers glued to their seats.The colours are beautiful,the village has a child like innocence,you feel sympathy for each of the characters that undergo pain and stress.The villain tries every possibility to kill Raagini.But she isn't the one who's there to get victimized.She's brave and she'll have a death at her own desired moment and none can change that.She's a fire brand and Beera recognizes it.She tries to escape,puts up a brave face and her eyes spark not even an ounce of fear.Some thing is influencing his mind to get mad about her.After all Beera has his own reason for the series of events which have occurred.He explains his grief and distress on what made him into a person whose emotions are unpredictable.One person having ten thoughts rolling inside his brain each second.Does this create a softer side of Beera in Raagini's heart?Will Beera ever spare Raagini or Dev?Is the person who dies always is the bad guy?Is this a thought of our society or if not what's the truth?Why can't we think on the lines on why is Beera like this?The gripping climax will provide a bold answer to these startling questions.The fight in the climax is precariously shot and will set the first bencher's abuzz.As like his previous movies,Mani pours life into a simple story and creates a mind boggling impact.Though not as polished as before,this works good time.The minutest details too are taken care off very well and the sweat and hard work gone into the making shows.If viewed as a contemporary version of the epic Ramayana,this one doesn't work.It doesn't have enough depth to penetrate the characters into the viewers.If seen as an experimental cinema,the ideals are great,the modification is inexplicable,so we better put our comparisons aside to satisfy us entirely.Credit to him though to make a film that's a break from the formulaic stuff.Coming to the performances,Abhishek holds his stand firm and portrays a character of varied emotions very well.He's grown as an actor since those days of Yuva,Bunty aur Babli.He displays the unpredictability of the character to perfection.I in fact do not want to watch the Tamil version of it because I expect it to be no way closer to this one. Aishwarya stuck between characters as different as chalk and cheese,two different sides of a coin handles her part extraordinarily.She's far beyond her skin and good looks and this one proves it yet again.She besides Abhi is the soul of the film.Her scenes with her hubby are of good taste and will evoke good critical acclaim.She looks to have put on a few pounds and the earlier she realises,the better it'll be as she isn't growing any younger.Vikram did a good job but he's done these better in Saamy,Anniyan and many other ones.There's no new facet of his acting explored.In short,he's wasted in an angry cop role.Nikhil Dwivedi is passable in a short role.Priyamani makes her presence felt and the start isn't at all bad for a debut.Ravi Kishan is irritating to say the least.Govinda packs a punch and tries to do something beyond slapstick comedy,an honest effort.Supporting characters are a mixed bag but they don't do that bad either.Rahman uses his experiments perfectly that's neither loud nor low.Gulzar's lyrics are pumping.Cinematography by ManiKandan and Santosh Sivan puts a viewer into the film.Raavan doesn't start well,but makes up for it as we move on into the film.It's a journey that we don't often travel and a path we rarely witness.Though not error free,its still a feather in the cap for Mani Ratnam to create such a splendid picturesque work.Be patient enough and keep your expectations a tad less and you won't be at loss.Its a drama,an event,a classic in the reckoning!" 
" Doesn't do justice with the great epic but still good entertainment...","Raavan is another movie from veteran Indian movie director Mani Ratnam. As the movie is the adaptation of Ramayana,(one of the greatest epic ever told) set up in the present world,I was pretty excited to watch this movie and had lots of expectations from this when i went to theater betting my 150 rupees on it(my whole week pocket money).As in original Ramayana there was a battle between good and evil.The good one was prince Ram(a epitome of complete virtuous,perfect man),his wife(a epitome of perfect,completely pure woman),his brother Laxman and Hanuman.The evil one was Raavan,a complete evil man,entirely opposite of Ram.Now,the events occurs in the epic are almost same in the movie too but as the movie is based on modern world,there is a difference in characterization so the consequences of the events occurs are also different.In the movie a naxalite bandit Beera(Raavan) who is also the lead character of the movie,kidnap Ragini(Sita) who is the wife of police officer Dev(Ram).Beera unlike Raavan is not completely evil(he is shown like Robin Hood). Kidnapping Ragini is not an act of lust and greed but but an act to avenge his sister's iniquitous death who was raped in police custody.He is wild,violent and ruthless to his enemies but he is not evil he also have a righteous side.Also,Dev unlike prince Ram is not righteous,he is evil and cruel and can outreach the limit of morals and ethics to rescue his wife.As the story moves Beera fall in love with Ragini and Ragini came to know good side of Beera and the dark side of her husband.Due to all this changes occurs,the outcome of the movie is completely different from the epic,but i admit it was brilliant.The best thing of the movie is its cinematography which is done by the very talented Santosh Sivan,he is the best at his work and this movie is the most brilliant work from him so far.The exquisite beauty of Indian forests,waterfalls,rivers and the villages are captured beautifully. Raavan has the best cinematography any Indian movie ever had,almost parallel to international standards(like Last of the Mohicans) and it is the greatest achievement for this movie.The direction of Mani Ratnam is very good and there is no doubt,at present he is the best director of India.Casting of the movie is grand and the performance from all the caste(except Abhishek) is splendid.The performance of Aishwarya Rai as Ragini is very powerful and colorful.In recent years,she establish herself as an actress of substance and maturity.Her transformation from a beauty queen to an talented actress is really worthy to be praise and admire.Once Roger Ebert said about her that she is not only first but also second most beautiful woman in the world,and I agree with him on this one.Now,she is the deadly combination of both beauty and talent.The other actors did their part very well.Vikram's acting as Dev was thrilling and chilling.Govinda and Ravi kishan both did well in small but important roles.The soundtrack of the movie is given by Oscar winner A.R Rehman and he did another outstanding job under his mentor Mani Ratnam.Among the bad things,the most disappointing is the performance of Abhishek Bachchan as a lead role of Raavan.He did not perfectly fit in the role and did lots of mistakes like his accent of a rural man and his expressions all seemed so artificial and out of place.He is among the most over-rated actor of bollywood and he continuously fail to deliver performance.He certainly was not the right choice to did the role.Plot development is another thing that disappoint me,the movie before interval was so fast and the events occurred very quickly and just after interval they inserted the song( and all those dancing stuffs,which i hate so much)this all things left me untouched and unsatisfied.The problem was in the script, you cannot make only 135 hour long movie on a seven books long epic(Ramayana is the second largest epic after Mahabharata) and also add two dancing songs.I admit ending was very good and make a lot of sense but the disappointment was in how they reached to the ending.I was delighted when i heard that Mani Ratnam was adapting Ramayana into the modern world.This is the first effort from bollywood to adapt such a great epic and only Mani Ratnam had the potential to do justification to such a great epic.But,i truly admit Mani Ratnam failed to deliver completely.Yes,the movie was entertaining and had every aspect that Indian audience expect from bollywood movie and there is no doubt in my mind that the movie will be a big commercial success." 
" Visually pleasing","Well by this time many would have watched this movie either in Tamil, Telugu or Hindi, but did Raavan or Ravanan lived to its expectation???? Thats a big Q !!!!!!! Frankly saying this is not Manis best movie. Each time his movie comes the expectation is sky high, but all his movies lived up to it. But with Raavan one cannot say it. The plot seems to be a very thin line, but with such a huge talented star cast, the movie could have been much better. Its not fair enough to say that this his best or worst, cos each of his movies is a yardstick on its own as all his movies are of different genre. Watch Raavan with an open mind, do not look for Ram alone in the movie cos u may be deceived. Its a visual treat from start till end, Mani is a genius, with the right team he has extracted the best from his crew, but still, when u walk out of the hall there is something in the movie ponders you. Is it the Ram or Raavan? Good or Evil???? Above all did the director achieve his target? Watch this movie in the hall or else u will miss the depth of the visuals which is absolutely breathtaking." 
