heading,review
" fantastic... go for it..","Review in form of an open letter to Farhan Akhtar,Dear Farhan,You simply rock. As director you have created all brilliant films, your debut film Dil Chahta Hai is a cult film, which inspired all directors of India to make fresh looking light hearted urban films. Then came Lakshya, which was not commercially that successful, but was nevertheless a good film. Don, from which I expected nothing, hated the idea as the original starring Big B is one of my most fav Big B film, was splendid and established you as master. As producer, you have attempted fantastic films too. And now as an actor, you are getting better and better day by day. You rocked in Rock On, you were fantastic in LBC and KCK and in ZNMD too you have successfully stolen the show from my favorites Hrithik Roshan and Abhay Deol who have established themselves as good actors.Your role in the film is quite meatier and helps you stealing the show. Hrithik (whom you originally wanted to cast in DCH) is again fantastic in serious-all-business-minded-guy and changed-in-love-living-life-guy both. Abhay Deol is as always dependable, his tricks in the films are hilarious. Chemistry between you three is awesome. It feels like three real friends are on road trip.I hope you make sequel to this as producer, keeping Zoya on director's seat again, as I think, she was brilliant as director. She might have lived her life with lots of male friends as it not for a single moment seems like a film directed by lady director (which was the only minus point of LBC from my point of view). Hoping to see more from her.Dialogues are fantastic and makes one laugh, smile and think for sure. Story, Screenplay and Script are marvelous. Music is in rhythm with film's flow.All positive – No. Something minor which I found not-so-positive was Katrina's suitability for Laila's role and SEL's music. Katrina has done decent work compared to her past films, but fails to convince what her character needs to convince (and though I don't like Kariena that much, but I feel she suited for this role very much) though Hrithik being her counter part balances very well, and Hrithik and Katrina looks good together. SEL's music is not as great as their former films, though manages to please.Fav Moments in the film: Too many. Though listing some of them.1. Kabeer's all tricks 2. Imran's flirt with Laila and her friend 3. Imran's each funny comment 4. Imran – Arjun fights 5. Bagwati 6. Each Poetry recited by Imran 7. The moments which inspires those Poetries 8. In the Air Scenes 9. Imran & Salman's meeting 10. Imran & Arjun's meeting their after 11. Kabeer's Flashback 12. Arjun crying after Underwater 'Meditation'All and over, it's not DCH, it's not Rock On. Though, it has shades of both the films, but it's quite different story to tell and as it has many pleasing moments, one must watch it.A film fan – Hardik Raychanda" 
" Brilliantly showcases India's growing individualism","On the surface, this movie is a fun-filled breath of fresh air. Fantastic starcast!!! Spain has been captured absolutely beautifully, and its culture has been shown very respectfully from the Tomatino festival to the bull race. It is refreshing to see brand new locales never shown in Bollywood with a down-to-earth yet glamorous starcast. Music is terrific as well.Each character and dialog has been penned with great consideration, and I am sure they are captured from real life. One can easily relate to the camaraderie among the three friends whether it be their silly, nonsensical inside jokes, impromptu fun-filled moments, or moments of pain and joy that strengthen their bonds, reminding one of his/her own most sincere friendships. Farhan's character's poems are delightful. The movie has been directed magnificently. There are some amazing scenes, my favorite being Hrithik's becoming inundated with feelings after his deep-sea diving adventure. Performances are great by all, but Hrithik is the most impressive. Katrina also suited the role wonderfully.However, dig deeper and take a step back, and you'll see a brilliant, thought-provoking, and excellently written film. While we are familiar with the Carpe Diem theme, we have never seen it embraced so wholeheartedly and taken so literally as it has been in this movie. As India's economy and mindset continues to liberalize, we see the birth and emergence of the carefree individual. There are numerous instances and decisions that display this attitude. The one that stands out is Abhay's decision to cancel his marriage despite the fact that both he and his fiancé like each other, he has proposed, and both families are involved. Another is Naseerudin Shah's dismissive attitude of his actions when he was young and his running away from his responsibilities for his artistic pursuits. Farhan and Hrithik have a one-night stand not knowing if they will see their partners in the future. All these incidents are not at all shown in a negative light. On the contrary, they are shown as a part of life that one should have the courage to accept so that each person can live his/her dream.ZNMD captures this mindset prevalent among the youth in India's metros and showcases it on a such a grand scale, which is surely going to accelerate this new attitude as it permeates throughout India. I believe this is going to make this a cult film to remember, which can join names like 3 Idiots, Taare Zameen Par, Udaan, and Wake Up Sid. I personally find it fascinating to see history repeating itself, with India's cultural revolution an uncanny déjà vu of 1960s America, which also had its share of cult films. (Some films to check out include The Graduate and Pleasantville.)On the whole, this idea of living each day as it is your last, not caring about what others will say, do, or think and pursuing your dreams without worrying about the consequences is encouraged. Some may find this thinking too radical and irresponsible, while others will find it liberalizing and enlightening. Purists and conservatives might find this movie disturbing." 
" A new idiom and metaphor","Farhan Akhtar's Dil Chahta Hai was an iconic movie and was like a breath of fresh air at the time of its release. Zoya's film is a wonderful expression and exploration of the new social dynamics in a fresh new idiom heralded by her brother's earlier work. In the last decade we have seen how some filmmakers have quickly adopted a new idiom, a meta language to depict the changing world order and the place that the modern urban Indian holds within it. Zoya does this beautifully thus elevating what could have been a very ordinary story to a level where it achieves an iconic status. The film depicts the coming of age of a trio of young urbane successful Indians who have to go through certain rites of passage to reach self realization. The element of modernism comes in via the unorthodox paths that these young men adopt to reach that vital stage of real adulthood when they are able to exchange short term temporary needs for real happiness, a kind of worldly "moksha" (oxymoron!)The trio undertakes a journey which becomes a metaphor for the journey of the self from boyhood to adulthood. Male bonding and real brotherhood (despite the fact that these men are just friends) is the thread that binds the story in a tightly woven fabric of delightful insights into the complexity of relationships in a modern milieu where the norms of old morality have been quietly exchanged for new ones. Love, romance, sexuality are dealt with in a way that is candid, frank and fresh. The locales that are chosen as settings for this journey are exquisite and breathtakingly beautiful, thus underlining the immense beauty of the world that lies at our feet when we are young and the world is still unexplored. So for example,we have one of the characters in a deep sea dive exploring the depths of the ocean and being reduced to tears by its beauty. The movie abounds in such life changing moments and there is not a single scene when the audience finds it difficult to relate to the protagonists or the storyline. I watched the movie on a week night in a mid-Manhattan cinema and the audience was laughing and silent at all the appropriate places. The film had hit the right spot. I congratulate Zoya and her team on the tight script, the casting, the excellent uplifting cinematography complemented by Shankar Ehsaan Loy's music and the wonderful direction of three great actors. I have always liked Abhay Deol. He is a brave actor and takes on roles that are not necessarily "heroic" (as in Bollywood) and always essays them well. Hrithik is seen in a new light and the sensitivity that he brings to his role is worth applauding. Farhan purports to be the "Joker" of the pack but is carrying a very real angst in his soul and that is done very well. For me the big surprise of the film was Katrina who comes across as having matured as an actor and looks gorgeous at the same time. There is a new wonderful trend in Indian cinema which we hope will continue unabated and is not killed by the more inane, mind numbing Bollywood brand of cinema. The only thing that will go against this film is that it will not appeal to the masses in the hinterlands where "DABANGG" has set a benchmark." 
" vagabond of emotions;this road movie is a trip to remember",""Seize the day", is the whole and soul of Zindagi Na Milegi Dobara. I was actually quite low on expectations with this movie. But this movie has turned out to be a vagabond of friendship, love, adventure, emotions and above all, LIFE.I always believed that Farhan Akhtar is a good showman. Right from Rock On!!, Luck By Chance and the duh Kartik Calling Kartik. But this movie has proved it that he has all the elements that are needed in an actor. He can dance, can cry (can sing of course) and now, he can make you laugh. Abhay – Farhan – Hrithik are the three mesquiteers.Zoya Akhtar is one more reason to watch this movie. The way she directed Luck By Chance was not all serendipitous, and she has proved it. ZNMD is all her baby. The male bonding penned and filmed by her is pleasant. The Spanish locations are exotic. Dialogues (By Farhan Akhtar) are real and spontaneous. Movie runs with its own good slow pace, which is very much needed for the road movies. Many scenes halt the heart and literally put you on an adventure mode.Movie would have been a way better if songs were good. Editing needed a bit more stitch. I have no complaints regarding the length of the movie, as I can watch this Spanish odyssey for more than two hours with a tub of pop corn and a coke.Overall, this road movie is a trip to remember." 
" Lovely, entertaining ...a made-for-the- youth movie!","Watched 'Zindagi Na Milegi Dobara' and completely enjoyed it :) Had I not seen DCH(Dil Chahta Hai), probably would have given this 5/5 !..Before leaving for the theatre I did see some average or not-so-good updates from some of my FB peers,nevertheless the movie turned out to be a class act (at-least for me). Three Cheers to Farhan,Abhay & Hrithik for superb acting and of-course kudos to Director-Zoya Akhtar. Agree, the songs left much to be desired but don't worry about it. I would recommend this movie to one and all.The movie targets the youth & the young adults much more than their parents." 
