heading,review
" Dark Noir masterpiece of Bollywood genre","The movie Zooms from 1984 era to current day, from sepia to Eastman color to the current times, the viewers are spell bounded and with pin drop silence, waiting for the fate of Susanna's husband.Like Sin City and other movies in related dark noir genre, 7KM will definitely stand out from all other contemporary Bollywood offerings. Kudos to Vishal Bharadwaj for marvelous cinematography and the equally apt music score which have kept the flow intact. Roles are also executed in perfection with great acting by all the Husbands,. From Neil Nitin Mukesh as general with a Dark side, John with a 80's hippie cum Rock star avatar, Irrfan in his usual best with eyes speaking more than his words, Aleksandr (Russian TV actor) with accented Hindi statements ( "MAIN TUMSE AMAR PREM KARTA HOON" usage in three different situations and moods shows the writer's situational understanding ), Anu Kapoor with all his 32 teeth intact and generously displayed, Naseer as Bangali Doctor (very less screen space) have all shown that the roles were thoroughly crafted for them. Usha Utthup and Vivaan Shah (Naseer's Son) were surprise packages and the later acted well throughout the movie (Though his makeup for the age of 40 plus was not very impressive). Now the Actor deserving a Standing ovation, after 12 different roles ( In Wats your Raashi), Priyanka has proved that she indeed is one of the most matured actors present in current bollywood era. Her character is shown with multifaceted shades, one moment you feel pit for her and the next you will hate her for what she just did. From bubbly 20 plus, enchantress at 30s, composite at 40, desperate at 50 and finally in salvation, she have swayed across the roles as a seasoned actress. Watch 7KM if you need to see and enjoy movies with a substance and the rating "A" given in the movie really means it." 
" Excellent build-up ends in an anti-climax","This movie had piqued my interest from the very day they announced its bizarre title. The trailers and promotions only reinforced the anticipation and built up the promise to a frenzy. Priyanka Chopra, without a doubt, one of the finest actresses of our times could deliver any kind of magic, especially when she is in a Vishal Bhardwaj film. Despite the disappointing ratings awarded by various critics we went to the theater; and held our breath.The movie begins with an adequately unfamiliar setting, like the village in a story you had heard long back in your childhood. Anything is possible there, and no one knows how vicious the jealous husband can be; or how vengeful the scheming wife. The first husband, Neil Nitin Mukesh, is murdered, in what arguably is the most convincingly executed plot. The next two, John Abraham and Irfan Khan meet their demise in reasonably well elucidated stories. After that, despite a sterling performance from Anu Kapoor, the plots drag, and get more and more difficult to digest. The links between the plots begin to fall apart and the cleanups lack meat. The climax is poorly woven with desperate attempts to induct mysticism and philosophy to cover up for the lack of substance. Vishal Bhardwaj should have restricted it to 3-4 Khoon Maaf and there would have been a lot less grieving from everybody. Priyanka has delivered dynamite as only can be expected from her. If any other actress was hoping for any awards this year, she might as well forget it today. John Abraham, Neil Nitin Mukesh have performed beyond expectations while Anu Kapoor's performance would remain as the most memorable among the male cast. Vishal Bhardwaj once again delivers short sequences of brilliant story- telling but in the end fails to package them into a masterful film. But do watch this movie for some skilfully crafted thrilling sequences, situational absurdities, witty dialogues, performances of Anu Kapoor, John and Neil Nitin and the magic of Priyanka." 
" Different Type of Bollywood Nonsense","4 stars because it was different. Difference does not mean good, especially in this case.I am not too sure what the director and editor were trying to do. At the end, I really regretted wasting my time on this. I actually just looked at the ratings in the IMDb before I went to see this. The rating seems to be artificial, much like all 'Mithun Da' movies on IMDb. I just hope that people are not being paid to write the 'supremely favorable' reviews.The movie is really badly made. None of the characters was developed to understand why they were doing what they were doing. Priyanka's acting is probably the second worst part of the movie after the disconnected plot. Climax is awful. I have not read the book it is supposed to be based on but after watching the movie, I have no hopes I would ever want to read it.I think anybody who wants to make a good movie needs to know what he wants the output to be which sadly is not the case with this one.Avoid. Thumbs down." 
" Long & Boring","All the credit in this movie should rightfully go to Priyanka Chopra. This woman was born to act, the likes of Rani and Kajol. Good actors are daring to take on any role that comes along and "Khoon Maaf" is not a glamor role for an actress. She excels in comedy (as in the funny sketches she did at the recent Z Cine Awards) and tragedy. The pace of the film is sluggish and you need to be glued (literally) to the seat to see all the 143 minutes of it. Neal Nitin Mukesh, is another good actor that has been under-utilized, since the problem with this Box office in India,is, the Mumbai Media imbeciles, which includes the so called critics are washing the behinds of Three Idiots (the ugly scum,the midget maccaca monkey and the Ek Tha Waterbuffalo) and only Scum Films like "Dabaang" are promoted. These type of movies appeals only the lowest of the low lives who have no taste or class. These bums will see any crap made by these Three Idiots and their kin. This is prime audience for these 3 suvvar mggots and the so called Bollywood scum producers who are given a front seat in all the award shows. Movies like "Khoon Maaf" stand no chance with a sophisticated audience." 
" Bhardwaj disappoints!","Priyanka and Bhardwaj don't know the meaning of a dark comedy and this one isn't as they promoted and claimed it to be. a big disappointment! Going by the book of acting, Vivaan Shah is at home and consciously or otherwise copies his father. Priyanka is OK as psychotic roles such as Susannaha have been done to death. Neil is impressive! Darkly filmed this is one should be seen with the hall lights on. And considering, and as it is obvious from the premise, the protagonist kills seven husbands, the let down is she is not exactly a femme fatal (alone) but is one of the sadists under the same roof. When she was capable of becoming a mother then why didn't she? Or instead of a husband, was she looking for a father figure as she was close to her's? Not clear! No thrills or twists the story just trots on! looking back Kaminay was dark (the way it was executed) too and was close to a black comedy. so the latter is one definition for a dark comedy for the director and his current muse. As an antidote for this looking forward to Tanu weds Manu next week!" 
" Starts with a bang...ends with a whimper","It would seem that my opinion of the movie is drastically different from those of the other viewers :-) Having said that, I will try to be balanced and not let the fact that I spent a 1000 bucks for this movie, influence me!The movie starts with a bang, literally - as we see what appears to be a suicide bid by Priyanka Chopra's character Susanna. It then moves into flashback mode - Susanna is a supposedly psychologically affected person who is unable to find happiness with any of her six husbands. Rather than do the easy thing and divorce them, she chooses to kill them by various inventive means. This is the plot - paper thin to the point of non-existence. The movie is a series of segments - each segment dealing with one husband. Each segment has a fixed storyline (almost like the director - was it REALLY vishal bhardwaj who gave us omkara and kaminey - had an excel spreadsheet with the mandated items needed per segment. Items are as follows: 1. Husband intro shot 2. Susanna eye-fluttering shot 3. Wedding ceremony 4. "Hot" sex scene, or a "daring" kissing scene. 5. Bad side of husband being brought to light. 6. Sidekicks and Susanna look menacingly at husband. 7. Husband dead. 8. Funeral. 9. Repeat steps 1-8 until audience is asleep. Now for the good parts. 1. Neil Nitin Mukesh is awesome as the menacing brutish officer Edwin Rodrigues (aka husband #1). His baby face is able to display negative emotions to great effect. The fight scene between him and the goonga uncle is also fantastic. A great actor, sadly under-used in this movie. After his character dies, the entire movie went downhill for me - primarily because none of the other husbands even matched up to him. 2. The songs are gorgeous. "Oh mama" and "darrrrling" are just too amazing. Gulzar sir - you are the light among shadows. 3. The style of the movie - fabulous. Each segment has its own style, setting, fashions, and attitude. If the director had paid the same amount of attention to the storyline and the talent, this would have been a great movie - there was definitely potential here for a black comedy.Speaking of black comedy, Kaminey was a much better example of the genre. In 7 khoon maaf, the genre is reduced to a bowlegged jockey cavorting in the dark. Not done Vishal sir, just not done." 
" Pathetic Plot for an expected good movie","Movie starts with a promise to end the drought of good movies in bollywood but fails miserably. Full of flaws and no real plot to pull the entire story through.Slow, flawed and awfully directed is the final word for this movie.Remember Kaun a small movie with such a small room , a wonderful movie spinning around the plot and great acting. This one was exactly the opposite.Save yourself the time and pain as this movie leads no where but to the drains.I wanna kill the person who suggested me to see this movie, in this case Deepak Vardey you be careful when you step out." 
