heading,review
" one of the most dark and disturbing movie in Indian cinema","well,despite being called a movie buff this was first ever time i watched first day first show of any movie and every effort was worth it,intrigued by the film title 'LSD' which is quite similar to the famous 60s drug LSD my first impression was the movie has something to do with drugs+love+sex+betrayal=youth though i was right the movie has everything sans the drugs.the whole movie is shot with hand-held or CCTV camera which gives it a very shaky and grungy look. Though the concept of movie being shot with hand-held camera is quite common in Hollywood and European cinema but these movies are either not available on Dvds or Indian viewers are just not interested in this form of movie-making.the movie has three different stories based on the same concept as the title suggests which later on intertwine towards the end..arguably this movie could well be called darkest movie of Indian cinema as first two of the 3 stories end up on a rather disturbing note.some of the scenes in the movie are brilliantly shot ..the brutally beating and chopping off the bodies of the two lovers with an Axe in the first story being one.the scene shook the spook out of me and as it seems is very much inspired from Gaspar Noe's 'irreversible's cylinder bashing scene.Actors in the movie are a bunch of nobodies..doing their first movie but no-one lets you down.Each one of the characters has done considerably well .director Dibakar Bannerjee as it seems is on a mission to break every cliché about how movies in India should be made or seen for that matter.After 'khosla K ghosla and 'oye lucky oye' LSD has cemented a berth for him in front row of the top directors.the most talented director after anurag kashyap i would say LSD might not make it big on box office it sure will have a cult following from those crooked minds who just want to lay their hands on everything that has something new to offer.i would give it an 8/10two thumbs way up for dibakar bannerjee..!!" 
" Who would have thought?","I watched this movie last night. It has been more than 20 hrs since then. The movie is still on my mind. I had to write something. I was completely blown away by the movie, and the Director, and the actors,and the camera work, and the writers, and the subject, and last but not the least, the complete outlook of the movie, which I reckon was biggest the USP of LSD. This is a 'First' in Hindi cinema. Mind you.This movie is about the harsh reality that exists in our society. There is no denying. There is no sugar coating it. There is no spoon feeding. There is no compromise. There is no pity. There is no make believe.It is in your face as it is. It's all real. The Actors have done a tremendous job. They have put those so called 'stars' to shame. I couldn't believe how natural they are, that It doesn't look acting at all. It seems you are watching real people through a camera. Dibakar Benerjee is 'THE' Director in contemporary Hindi Cinema among others. He has Director's attitude and aptitude. He knows what he is doing. and doesn't compromise on that. We need more like him to revolutionize the Hindi cinema. And I suppose it has already started in last 5 yrs or so. Amen. Let me tell you that LSD is not for everyone. So how do you tell if it's for you or not? Only you can decide it. Do yourself a favor. Go, watch it with an open mind." 
" LSD: Something new from our Hindi film industry","LSD 8.67( dividing by 3 this is what comes)Warning: Whoever is thinking of catching this movie in next week, forget it. Its gonna flop, not because its a bad movie but because its different. Not everyone would welcome its experience. Boring and bakwas would be two common terms about its review.About movie:- LSD or Love Sex aur Dhokha is a different movie experience, its kinda what they call piece-of-life movie genre, only here we have three incidents loosely connected. Just for the transition I guess.Three stories on three different human nature. First story is about love. Its the best. Good acting by the actors, sharp dialogs. This is a new level of violence, not gore but totally uses ur imagination, a shocking experience indeed. 10/10Second story is about Sex (which is absent): A bit slow, and stretched. This part is (I think) inspired by an MMS, I've seen that. The MMS is 6-7 yrs old and for the scene, had kind of similar background. Though stretched a bit, the acting is very good by all of them. The main gal kinda sucks at last sobbing scene. Her crying was not convincing, I guess dats why her face was not in focus. Good but looong story. 8/10Third story is about dhokha (fraud, betrayal). Good acting by the reporter guy and the gal. Not a good storyline or just a bit different. 8/10I say, the director did a very good job by getting out such a believable performance from all newcomers. Kudos to Dibakar Banerjee. Hope to see more works from him but with a good story in that case. I missed a start, middle, end here.I agree this is not a conventional movie but its just my opinion or wish." 
" An entertaining bold movie for Bollywood - But Bollywood still cheats!!","When Johnny Gaddar came out three years ago I had got a feeling that Indian Cinema is beginning to come of age. It was executing scripts which were never written before. Soon scripts like Oye Lucky Lucky Oye, Gulaal, Dev D, Khosla Ka Ghosla, Rock on!, Ishqiya, Taare Zameen Par, Black Friday etc had the cake of Indian Cinema nicely baked. Love, Sex Aur Dhokha is almost like an icing on that cake. You can safely say Indian Cinema has come of age and is never gonna look back to the Star system (read Khan System) and the Yash – Barjatya house of melodrama. Even if that will continue to sell more is irrespective.Still let me point out LSD is not an original its style and premise is copied from Adam Rifkins Look.Nevertheless, Whats the fuss ? Unfortunately I cannot reveal how LSD unrolls itself and I would suggest you go into the theater expecting nothing. Please do not read any reviews from any national dailies critics they just end up revealing just too much. So whats the bottom line: Dibakar Banerjee undertakes a biting satire study of the growing fascination of the Indian Middle class with the camera whether it is the MMS scandals, or the umpteen sting operations. Just Like OLLO he takes a heavy dig at the media, the mentality of the Indian middle class and even our fascination with sting operations and voyeur sex. The beauty of the film lies in the fact that it is actually shot in the first person point of view. Through your web cams, through your hand held, through your Security cams etc.It must have been difficult to shoot like that but it must have been even more difficult to get the emotions of the characters on screen through to the audience when there are no dramatic camera angles, no mid shot and no extreme close up to shoot. Dibakar however manages the perfect mix of these shots using in most cases a still camera. You feel heavily for his motley crew of characters as they feel happy or totally disoriented in the emotionally heavy (read shocking) script.That's where the most superlative cast I have ever seen comes on screen. At times you get the feeling Dibakar might have just let them play themselves and left his handy cam on. I don't remember any name but each of them are plain brilliant there's is just no other adjective to describe them.There is also the most perfect concoction of Humour, Romance, Mind Numbing Violence, Biting satire, strong emotion and sex in the script. To top it Dibakar just refuses to switch off the camera even when you are cringing for the visual to stop. Once the camera's REC button is switched on you better be ready to sit through everything!!And of course for Delhi lovers lets make no mistake, the typical Delhi characters which is trademark Dibakar with their "Behenchods" and "Oye Haan Jee Haan" are all back with the kick ass Bhangra scoreWatch out for the Typical Delhi Office store clerk in the Sex episode who goes with sentences like "Waah Waah Badi Nehru Market Lag Rahi Hai"Final Verdict : Go watch it and remember this is where Indian Cinema has finally caught up with its international counterparts.Special Mention for the Item number " I cant hold it any longer" . Just pay attention to the lyrics and the chorus which actually goes "FO FO FO FO"I would have given it a 10/10 but for the fact that it is copied from LOOK." 
" Dibakar proved himself...for the third time!!","LSD was a film not made with hyper-cryper budget...just a budget of 1.5 crore and a film which is not even tried by any other film-maker in bollywood..film has three stories...all of them developed well...and the violence in the first story...when those guys cut the couple in pieces..i was thinking that even QUENTIN Tarantino haven't showed such violence in his films...i was really feeling sad for them..and the way the whole movie goes is really outstanding..i knew that dibakar had the potential bt now after watching LSD...i am damn sure that he cannot give a flick which is not worth being called legendary..he has become my top most fav. director..the thngs he put up in his films is sumthing which we experience in our daily life...every small small things he keep in his mind while making filmz...5 years as a director..3 films at a gap of two years each..nd the most clean record anyone could have ever made in my opinion...khosla ka ghosla...9.0...oye lucky...8.9...and LSD..8.8..though i rated it 10 as i want it to get good stars on IMDb...dibakar rocks...a must watch film for everyone..and don't watch it with your girlfriend...would b better..!!8.8 / 10" 
" MY REVIEW: brave, disturbing, path breaking","Dibakar Banerjee after cult Khosla Ka Ghosla and smart Oye Lucky Lucky Oye tries something very different and he succeeds by a distance. The three stories narrated through cameras that are actually part of the story gives movie a authentic feel. The first story takes its own time to grab your attention and ends you making silent. Second story is best in narration, acting and impact. Third story is the weakest of the three but at the end when all three stories club together is seamless. The song at the end of the movie helps multiply the impact of the movie. The entire cast is new but very convincing.It is brave, disturbing, path breaking and changing face of bollywood cinema." 
" Most daring bollywood movie","This is perhaps the most daring bollywood movie I have ever seen. It is Dibakar Banerjee's finest work and one of the best Indian movies to come out in a decade.I was reluctant to see this movie at first. I was not aware at that time that it was directed by Dibakar Banerjee. I had only seen rushed promos and to me seemed it was one of those shaky cam movies, probably inspired by some foreign movie. But appearances can be deceiving, instead it turned out to be one of most original bollywood movies.Dibakar Banerjee has excelled himself. His latest venture is daring and more realistic than anything that has come out of bollywood.LSD is comprised of three stories which are somehow interconnected. The first story which is about Love pays a tribute to Dilwale Dulhaniya Le Jayenge. Rahul is a young student director. He is an ardent fan of DDLJ, and wants to be like his namesake Rahul, the protagonist in DDLJ.I don't want to reveal anything more. The movie is a treat and a very good mix of comedy and drama." 
" Excellent, film making at its best, big directors should consider this before making any crap love stories","The direction is so good that at any point in the movie you will not get bored. The three incidents are so correctly framed. The acting is good. It is not necessary to hire super stars to make a good picture even the new once can do better. It's up to the director and the storyline to make the difference. With this its surprising that these days low budget movies are doing great such as khosla ka ghosla, Phas gaya re obama, tere bin laden, etc. All bollywood big budget directors should concentrate on story and less on item numbers its the good story which will take them to Oscars not Sheila Ki jawani... lol. I recommend that you should watch this movie its different then any other crap love stories of Bollywood." 
