heading,review
" FKS is like a 'Ride on a regular Indian road with inevitable bumps'.","Its a sweet simple movie straight from the heart wit a lot of sincerity, having some beautiful moments that ensures a smile on your face. However the movie has enough hiccups that hampers its smooth flow ; too much unnecessary time is given to the scenes involving relatively unimportant characters which adds to the length of the film.Also FKS tries very hard which wasn't needed and the plot takes too many liberties in the end.Revealing those things will be a spoiler. The biggest strength of FKS lies in its lead characters' top notch performances.THe young kid looks confident in every scene and also he looks very similar to his on screen father,superb casting. Boman Irani as grumpy old man is superb .But its the under rated Sharman Joshi who is such a revelation in this film ,delivering his best yet and becoming the best reason to watch this film. watch out for the scene in which he pleads to a loan officer with a smile of hope of getting the loan ..outstanding expression. When Boman and Sharman are on screen they just raise the depth of those scenes.. Not a gr8 film but surely worth a watch .Such a nice clean film are very rare these days" 
" A simple, sweet and a totally enlightened movie!","Very very rare are the totally simplified films these days in the era of exaggerated and technology oriented movie making. Ferrari ki sawari is one such film that really makes you believe that simple movie making does really exist.Okay, now for the performances, Sharman Joshi gives a fabulous performance as the dad going to any deapth to uplift his talented son. However the real show stealer is none other than Boman Irani.Irani plays his role with such honesty and explicitly that one can't help but can either admire him or relate with him. His is simply phenomenal.Supporting both the actors is this young kid who plays the role of the son of Sharman. He is just amazing!Oh yes! Not to mention Paresh Rawal in a brief surprising role.Overall this film is really worth watching!" 
" Brilliant performances, Nice but a little long movie.","I loved the movie. It was funny, entertaining, emotional, light hearted.I would have loved it even more had the second half of the movie been a little shorter. But nevertheless, its a family movie apt to be watched with family on a lazy Sunday afternoon. They have tried to put a lot of things together in a single movie, and the people behind the movie have done a fantastic job of making it all come seamlessly together.The child actor has done a very good job. The concept is good, the direction is great. Only let down is the second half which is little impractical and dramatic unlike the relatable first half.The family dynamics can actually be felt. Brilliant performances by the lead actors.I wouldn't call it a must watch, though a movie is easily a 8/10." 
" A Ride Little Bumpy","Ferrari ki Sawari (FKS) is one of those movies which ends on a note so high, both emotionally and morally that you don't really have a choice but to summarize it as a 'good watch'.Its a movie set up in a world where everything would ultimately fall in place and has people who fall on the extreme ends of the human axis. Even in such an improbable world, director has been able to successfully fit in a juicy(carrying potential)enough script without making it much of an embarrassing affair. It would have been an elegant and far better piece of cinema had it been without its extended sub plots and some out of place characters. That would have automatically made it a shorter and crispier ride on the Ferrari. But then it would not have been a Vidhu Vinod Chopra Production.It goes without saying that the presence of Boman Irani was an absolute necessity for FKS to have its core in the right place. I wish he gets to do more of such roles where one can sit back and admire the talent this guy has and wonder where he was hiding before he broke into the scene. Of course it is Sharman Joshi who has come of age and has been satisfactorily able to carry the movie on his shoulders till the very end. It is a movie where you would leave the cinema hall thinking of it as a paisa vasool picture but at the same time you would know that you have somehow been tricked!! Go watch the movie for little flashes of brilliance and to have a feel good trip from the theatre exit to your car." 
" Amazing Movie","this movie is amazing i have seen this movie at least 1000 times and i am not tired of it i love Boman Irani in this movie and Paresh Rawal has a awesome part in the movie as well they show kayo family so poor and it is just awesome movie i would just rate this 10 out of 10 there is one problem in this movie everything is perfect but there is one thing missing they should have had Sachin Tendulkar in this but other then that everything in this movie is perfect i highly recommend you guys to go watch this movie i hope they give the kid kayo more movies and i hope he becomes a star they should make a Ferrari Ki Sawaari part 2 it is that good" 
