heading,review
" Donates Genuineness in Peculiar Small Films","Blood Donation is an old theme nowadays. Why not sperm? Fertilization has been shown previously in movies like I AM, The Tree Of Life and more. But Vicky Donor bring an aspect of Comedy involving fertilization in the movie. That's a different and peculiar attempt introduced in Bollywood movie. A fresh theme with fresh stars featured in a feature film - Vicky Donor.John Abraham, The new boy in Producer Town does an earnest effort here and deals with a fresh theme based on a totally out-of-the-box concept. John after acting on 'masala maardhaar' movies now starts investing money on offbeat movies - that's strange but is smart also as the promos of Vicky Donor has a youth appeal also keeping beside the sperm oriented theme. Some in the town thinks Vicky Donor is somehow sex-oriented and disgusting in theme as it deals with such vulgar things like sperm donation and fertilization. Anyhow still Vicky Donor makes its individual impact in Bollywood and its pretty good.In an environment where the job pressures are high and couples lead an erratic and unhealthy lifestyle, Dr. Baldev Chaddha (Annu Kapoor), a well-qualified fertility expert, runs a fertility clinic and a sperm bank in Daryaganj, New Delhi. Unfortunately, he has more failed cases to his credit than successes. A healthy, high-performing donor is the need of the hour.Vicky Arora (Ayushymann Khurrana), a young, good looking Punjabi guy from Lajpat Nagar, is the only son and of no financial support to his mother Dolly (Dolly Ahluwalia), a widow, who runs a small beauty parlor from home. As luck would have it, a small brawl in the colony brings Dr. Chaddha and Vicky face to face, where Chaddha concludes that Vicky could be that donor he has been looking for. From here on, Dr. Chaddha's days and nights are spent in convincing Vicky to become a donor till he finally gives in.Vicky finds his love interest in Ashima Roy (Yami Gautam), a pretty Bengali girl, who works in a bank. But soon their hunky dory world comes crashing down because of Vicky's past as a donor.Vicky Donor is a special mixture of Youth, Romance, Sperm Donation type offbeat concept and Comedy. So, compilation like this is hard to find in recent movies and there's where VD wins the race for its individuality. Even being a small budget film, VD gives you the feel of the same amount of humor, romance and consciousness about the concept used in a big budget film. It enlightens, then entertains and then wins.Shoojit Sircar, after giving such a serious movie like YAHAAN (2005), it was very unlike to see a comic movie from him after 7 years. Anyway he deals very well with Vicky Donor and gives justice to the concept. Story, Dialogue and Script by Juhi Chaturvedi was very neat, sophisticated and came to a very good conclusion as the two parts of the movie was capably balance. Cinematography was not such a big deal for the movie but still good work done by Kamaljeet Negi. Editing by Shekhar Prajapati was good. The soundtrack of the movie is mediocre but still tracks like PANI DA RANG (sung, written and composed by the lead actor of the movie Ayushmann Khurrana), MAR JAIYAAN & RUM WHISKY work perfectly. These three songs are worth listen for many times. Background scores also by the music director duo Abhishek-Akshay duo are perfect for the movie.Shoojit Sircar, I must say has chosen the actors for the movie very aptly. The very famous face from the Television Ayushmann Khurrana is good-looking, humorous and a very good performer. The naturalism in his expression and act was fascinating and profound. Another fresh face from Television Yami Gautam was strikingly beautiful, sensible and a good performer. Her presence and charm in various sequences adds value to them. Annu Kapoor aka Dr. Chadda is an anomaly. His humorous acts, sensitive acting adds the movie a new aspect.Dolly Ahluwalia (Vicky's Mom) was very well as well as Kamlesh Gill (Vicky's grand-mom). Jayanta Das (Ashima's father) was fine. John Abraham makes a stunning impact on viewers by appearing in the song "RUM & WHISKY".Finally, Vicky Donor is just like sperms, tiny but very effective and gives birth to a new idea in entertainment. With genuineness in script and rigorous performances by leading actors, Vicky Donor is successful in making a strong ascendancy in small budget films. Try not to miss this one." 
" The most pleasant surprise of the year... a really witty, feel-good joyride!",""The best things in life come in small packages.." This adage came to my mind when I stepped out after watching 'Vicky Donor'.. Easily the best socially relevant comedy made in recent times, this one needs to be appreciated for its natural wit & intelligence in dealing with a sensitive issue in a non-preachy way. The movie manages to entertain as well as enlighten, & thats' a rare feat in context of Hindi Cinema. The movie succeeds in driving home its point in a subtle manner. Newcomer "Ayush-Man" is a complete natural in his roguishly charming Delhi guy act, while fellow débutante Yaami Gautam has extremely likable screen presence & is a competent performer as well. As a pair, both of them have a great on-screen chemistry, & their romantic track blends well with the story. On the other hand, every member of the supporting cast is an absolute delight to watch, especially Anu Kapoor as "Doctor Fertility". The music is also quite good, with "Paani Da Rang..." being the best pick with its soothing composition. There is some emotional drama in the 2nd half & the culmination is arguably convenient, yet it suits the "feel-good" tone of the film. Overall, this is a crisply entertaining movie with a BIG heart. Highly recommended for lovers of good cinema, & a welcome break from all the crude slapstick "comedies" that are regularly dished out at the Indian Box Office in the name of entertainment. A complete surprise package!" 
" Vicky Donor (U/A)--------------------Rating: 5/5","wow...fantastic movie with the heavy n strong concept...... the movie contains about raw usage of script and more comedy with beautiful songs.... A must watch film.... Very difficult to find but some conservatives might not like the concept...A man is brought in by an infertility doctor to supply him with his sperm, where he becomes the biggest sperm donor for his clinic. Vicky Donor is a light hearted comedy that takes a look at the taboo attached to infertility and artificial insemination.The Story .. of courseDr Baldev Chaddha (Annu Kapoor), a well qualified fertility expert, runs a fertility clinic and a sperm bank in Dariyaganj, New Delhi, that guarantees a high quality and specialized sperm for the purpose. Unfortunately he has more failed cases to his credit than successes. A healthy, high performing donor is the need of the hour. Vicky Arora (Ayushmann Khurrana), a young, good-looking, Punjabi boy from Lajpat Nagar, is the only son and of no financial support to Dolly, a widow, who runs a small beauty parlor from home.As luck would have it, a small brawl in the colony brings Dr Chaddha and Vicky, face to face, where Chaddha, concludes that Vicky could be THAT donor he has been looking for. From here on, Chaddha's days and nights are spent in convincing Vicky to become a donor till he finally gives in. Vicky finds his love interest in Ashima Roy (Yami Gautam), a pretty Bengali girl, who works in a Bank. But soon their hunky dory world comes crashing down because of Vicky's past as a donor. With a brief emotional roller coaster ride, Vicky Donor is a light-hearted take on the subject of sperm donation.What to look out forSparkled with exceptional performance by Annu Kapoor as Dr. Chadda and the wonderful debut by Ayushmann Khurrana as Vicky Arora.. Vicky Donor is a fertile entertainer with focus to tell an endearing love story centered round sperm donation glory..John Abraham deserves a special pat for not following bollywood trends as a producer and opting for a out of the box subject on sperm donations for his debut as producer and not using his stardom and making way for a newcomer for a wonderful debut.. highly remarkable..Shoojit Sircar grows immensely as a story teller and shows vast improvement from Yahan (2005) to Vicky Donor. With the all round support of his writer Juhi Chaturvedi he captures the mood of Delhi in light, funny and tangy first half then giving us those genuinely stirring moments rather late in the game and ending up with a sweet note.All this wouldn't have been possible without the active support of Yami Gautam who makes a beautiful debut.. Watching her is treat to your eye and the girl delivers a sparkling performance.Dolly Ahluwalia is excellent as mom and Kamlesh Gill as the grand ma is outstanding.. Whenever she appears on screen she eats up other actor's presence. Jayanta Das as Yami's father is adequate.Music and dialogues are in sync with the film. Pani da song is the pick of the lot.. editing is sharp and other technicalities are fine. Production values are up to markWhat NotVery difficult to find but some conservatives might not like the conceptConclusion: Vicky Donor is avant grade cinema that is fertile at the Box Office. Those who complain Bollywood for running out of ideas.. 'Vicky Donor donates sperms of hope.. a must watch.." 
" 7.5/10 - Delightfully deft!","The chief concerns of a 25 year old? Money, a job, a girlfriend and some respect from his family. Vicky Donor injects a new age career (if you may call it) of donating sperms in to the life of a happy, cricket loving, 25 but jobless Delhi boy Vicky (Ayushmann Khurrana). After Dr. Baldev Chaddha, (Annu Kapoor) an infertility specialist overtly chases Vicky for this covert job; he begins to enjoy the perks that come along with the job. However with great perks come great pains. Great perks – money, job, girlfriend (incidental to the job) and respect from his family. Great Pains – Not being able to tell his family and girlfriend about his career. So do the perks outweigh the pains? Or life is beyond such naive comparisons? For the answers, watch the movie!While you are at it, you will be treated to some delightful real life characters, Kamlesh Gill as Vicky's alcohol-loving, forward-thinking grandma, Dolly Ahluwalia as Vicky's alcohol-loving, loud and dutiful mother, Annu Kapoor the singularly focused Dr. Baldev Chaddha, the beautiful Ashima Roy (Yami Gautam) and her oh-so Bengali family. The banter between Kamlesh Gill and Dolly Ahluwalia, Annu Kapoor's character who sees life through the lens of sperms will keep you chuckling through the movie. You will want to cheer the celebration of differences and the eventual mingling between the Punjabis and the Bengalis, brought to the fore in the wedding sequence.Is this Ayushmaan's debut? Wow! Doesn't seem like that! He comes across as completely natural and never seems anything besides Vicky! He is absolutely lovable as the boy next door. Annu Kapoor is scintillating. He amuses you and makes you laugh. Kamlesh Gill and Dolly Ahluwalia are uncontainable. Debutant Yami Gautam looks delectable and performs well. Juhi Chaturvedi's very believable story has a thoroughly enjoyable screenplay where witty one-liners are the order of the day. Kamaljit Negi's cinematography is good. Shekhar Prajapati's snips ensure the movie never slows down. Abhishek-Akshay's music carries the narration forward while Rum Whiskey will be a party smasher!Director Shoojit Sircar after a hiatus of 7 years (Yahaan 2005) deftly blends in a topical story with some endearing characters and real life sequences to dish out a delightful slice of life film! Go watch it!Watch for: A topical story. Light hearted entertainment. Watch out for: Performances and some superlative real life banter between the characters! Don't watch if: No-no. Go watch!Story: 7 | Screenplay: 8 | Performances: 8 | Songs and Music: 7 | Direction: 8 | Overall: 7.5/10" 
" A great quality 'sperrrm'...errr.... movie!!!","Some trailers makes me want to go to the theaters the first day; some trailers, I don't want to watch even the trailer completely. With VD, I was not sure. So I went anyways. Thank God I did. From the first scene to the last, it was worth it.A great script dealing with masturbation indirectly yet without any vulgarity in words or scenes. It will easily pass off as a 'modern' family entertainer. It is not easy to bring out the film in such a great script and kudos to the director and editors for sending out a altogether new message and getting it out from the actors. All the actors were spot on. But a special mention to the mom and her in-law, and their on screen chemistry. The leads have also done well, but Annu kapoor is the class act. Then final scene in which he breaks- down laughing, makes him in the list of my great actors in India. No unnecessary songs,long shots, close-ups, drama etc,. it was all just about perfect. There were some pit falls on the acting in some scenes of Anshuman and Yaani, but come'on the made up for it later. All together a great movie, coming in the times of Kahaani, Paan Singh Tomar etc,. only shows that this might be India's turn to its greatest star ever- The Script.Rush and watch!!!" 
" Donate Some Time To Vicky Donor - Worth It :)","Very Recently I had an argument with a friend when i asked him that out of the two movies released this Friday which would be given preference bu him. He said and I'd quote that "(It's a)disgrace that people can actually watch this".No offence but Vicky Donor would be like a slap on the face for such people. It is fresh, entertaining and thoroughly enjoyable.Starring Ayushmann Khurrana as the Punjabi munda Vicky who doesn't have a job of his own and is constantly nagged by his mother played by Dolly Alluwalia. His grandma, on the other hand as Vicky himself says pretty modern and very supportive. All's not well for him until Dr.Baldev Chadda played by Annu Kapoor finds out that Vicky can be an excellent sperm donor. Midway he falls in love with Ashima Roy(Yami Gautam) and the story carries on further.The interesting part about Vicky Donor is that although the film preaches the topic of sperm donation at no point does the film uses vulgarity or cheap humour to carry it along. The music is very catchy at the least and songs like 'Paani da' and 'Rum whisky' really help to keep up the tempo of the movie.The screenplay by Juhi Chaturvedi is apt and even the 2 hr 15 min doesn't seem too long.Yes the dialogues are a bit repetitive, the story a bit sluggish in parts but the good acting performances by the entire cast hide the negatives more or less. Annu Kapoor, Dolly and her mother-in-law impress in particular. Ayushmann has very good screen presence and Yami looks superb.It's a definite thumbs up from my side for Shoojit Sircar's Vicky Donor. You should not give this a miss if possible.3/5" 
" Perfect Entertainer....Light Comedy with Heavy Topic","It turned out to be pleasant surprize form Vicky Donor. While I waited for one week for the reviews before confirming if the movie is watchable, the movie stood tall in all aspects. Anu Kapoor is back with a bang with some impressive performances by Ayushman and Yami. The movie provided the right perspective to look at sperm donation and its importance. Though the conservatives with frown at such issues, even from the entertainment point of view, the movie provides everything that audience expects from a movie. The punches are spot on in terms of timing as well as dialogs. While a majority of the dialogs are in Punjabi (which might repel certain set of audiences), it just improves the originality of the plot. Music has been another highlight of the movie with the song "Paani Da Rang" being the masterpiece. Overall, a good 2-3 times watch." 
" A refreshing surprise!","To people who would like to believe that this movie is vulgar, I would suggest, go along with your kids! It's a refreshing surprise from director Sircar, and is 2 hours 15 minutes of pure fun. Anu Kapoor stands out for his once in a lifetime portrayal of an infertility specialist. His props, clinic and the hand gesture (just loved it) are just amazing! I am forced to wonder why is he not more visible on screen! Ayushman is a complete natural as a punjabi boy. Not for one moment would you even feel this is his debut in bollywood. Yami Gautam is gorgeous and appears very soothing to the eye. The modern grandmother and mum have been excellently portrayed by the respective actors. This is perhaps first time in bollywood that you have a saas-bahu and daaru scene! Two characters that really stand out throughout the movie are undoubtedly Dr Chaddhha and the grandmother! A must watch for everyone" 
" Vicky Donor: Better than I expected","I don't like Bollywood cinema, it has just never appealed to me and therefore I tend to avoid such movies like anything with Tom Cruise.I found myself watching Vicky Donor as it's supposed to be an Indian remake of the excellent French Canadian movie Starbuck (2011). I'll say right off the bat, it's not............it really really isn't and they need to stop making that claim.A very high rated Indian movie it tells the story of a lovable loser type who reluctantly begins donating sperm. He hides it from his family and the woman he loves because for some reason it would bring great shame.That's it, so again this is not Starbucks plot at all despite being advertised as such.It has most of the Bollywood tropes but thankfully no sudden dance numbers, I really couldn't have sat through it if there had been. There is however a heavy soundtrack and in this guys view it damaged the film.The soundtrack grinds, the characters certainly could have been more likeable and much of the film feels like a melodrama more than anything else.However on the flipside some of the writing is excellent, the plot though simple is handled well and the finale really saved the movie.Vicky Donor is not Starbuck but it has it's own identity and for a guy who hates Bollywood I can't deny that it certainly has its moments.Vicky Donor is an enjoyable affair despite its flaws.The Good:Yami GautamSome of the script is exceptionalGreat finaleThe Bad:Randomly shifting back and forth between languages mid conversationFrustrating soundtrackNot even remotely the Starbuck storyJokes tend to miss their markThings I Learnt From This Movie:When a movie starts with the fact it was created by the "Eros" network it makes a person pause and recheck they have the right film!Indians talk so fast it can make subtitles a chore at timesIf "God" wanted you to have a child surely you wouldn't be infertileShaking hands with someone after they've made a sperm donation seems like a bad callThe word "Coming" was used a suspicious amount in this film, intentional?!Banks allow their employees to go in after hours to mope dramaticallyA person who refers to everyone as sperm would likely not be on my speed dial" 
" finally a good 2012 bollywood movie ...!!!!","VICKY DONOR - firstly i liked the title very much and trailers also sounded good.the movie truly satisfied the trailers which normally don't occur in case of most of the bollywood movies.The trailers are made good but when we see the movie the only dialogue we say - what the f**k is this ? now about vicky donor - its a good comedy movie.lots of dialogues are in punjabi and are so hilarious.the punches are so good.AYUSMANN KHURANA gave a thrilling performance.didn't seem like his first movie and the actress YAMI GAUTAM was also fab.overall the movie is superb. MUSTTTTTT WATCH GUYS..........!!!!!!!!!!!!!!!!" 
" Vicky Donor - Best Sperm ji ;)","Vicky Donor a light hearted movie deals with a taboo subject of Sperm Donation. Movie kicks off with an infertility clinic in Daryaganj , Delhi being run by Mr. Baldev Chaddha(Enacted by Anu kapoor), who has a client list of mostly failed cases! He is in search for a sperm donor & he gets the same as Vicky Arora (enacted by Ayushmaan Khuranna).Vicky is a boy from middle class family residing in Lajpat Nagar. He is job less & super lazy! He is a lively character though, full of life, always happy, loves shopping & playing cricket. His mother is widow & runs Dolly boutique at her home only & home runs on her earning only. SPECIALLY FOR THE PUNJABIS THERE ARE SPECIFIC MOMENTS YOU WOULD SURELY LOVE LIKE VICKY'S MOM & GRANDMA DRINKING WHISKY & TALKING IN PUNJABI! Good hearted comedy! And to add to the charm was Ashima Roy - Bong babe! ( Enacted by Yamini Gautam), she completely wins you over with her beauty & charm!Vicky donor is basically a story of how a guy gets into sperm donation bcos of an irritating & glued Mr.Chadha, then continues it because of greed of money & takes it up as social service, then he fells in love with Ashima, a banker who is divorcée & soon after getting nods of their families both tie up the knot, but soon they discover they cant be parents & Ashima gets to know Vicky was a sperm donor & how their relation goes through the highs & lows of life & how they eventually get back together & Ashima accepts him the way he is bcos he donated to make other families happy! Let the review be this much or i might end up spilling the whole story! Go for it worth a watch! If i vote for it as a Punjabi then 8.5/10 For a normal viewer - 8/10.Don't expect anything go with a light mood & you would come out smiling! All characters have been very well enacted by respective stars! STAR FACTOR- JOhn Abraham in Rum whisky! Smokin he is! ;)" 
" A nice movie!","With the passage of time audience have seen that the cinema has changed. I would call it a 360 degree change. There were times when action flicks used to be the talk of the town. There used to be an angry young man beating up the goons either for the sake of vengeance or for proving his macho character. Then there were times when love stories were liked by budding lovers and college sweet-hearts, those movies used to have some great music compositions which were instantly liked and loved by the listeners (of that time). Now weird (for some people) and interesting (for other viewers) movies are made. At some circles slapstick comedies are encouraged and on the other hand people are also appreciating thought provoking cinema. This particular movie, "Vicky Donor" is a combination of both.The movie might not get success, on the basis of its topic, screenplay and concept, if it would have been released in 90's or even in 2000's. Audience is much more ready to accept things nowadays. The movie is tale of a Punjabi boy named Vicky Arora (Ayushman) whose great grandfather had 19 children. This story also revolves around a (not so successful) middle aged Doctor Baldev Chadda (Annu Kapoor) who specializes in infertility operations and he runs a fertility clinic and looking for a sperm donor. Last but not the least, this movie also revolves around the love of a Punjabi guy with a Bengali girl Ashima Roy (Yaami Gautam) and their trust and understanding.The theme of the movie is really interesting yet controversial, for some. Dr. Chadda convinces Vicky to donate his sperm so that he can give happiness to those parents who are not blessed with their biological kids. For this he quotes some factual yet hilarious examples to Vicky, regarding Mahabhaarat's time. Finally Dr. Chadda convinces Vicky and he starts to donate sperms. The sequence between Annu Kapoor (as Dr. Chadda) and Ayushmaan (as Vicky) are amazingly hilarious and here definitely Annu Kapoor being a veteran actor takes the audience to the heights of laughter. It is not easy to share the screen with Annu Kapoor but Ayushmaan makes his presence noticed strongly. They both complement each other in almost every scene be it be dramatic or funny. Those who know the roles portrayed by Annu Kapoor in his career will never doubt that he has a caliber that is not shared by many actors. Be it his "Gali Gali Chor hai" or "7 Khoon Maaf" both roles portrays huge contrast. For those who really want to see his amazing performance must watch "Ek Ruka hua faisla" (21 years old young Annu Kapoor portraying a 59 years old lawyer).On the other hand (débutant) Ayushman is also full of surprises. He performs extremely nice as a funky, easy going and smart ass boy at one place, whereas he astonishes audience in climax (I don't want to spoil the experience – watch it yourself). Be it a serious thing or comical the young talent has the potential to get noticed. Yaami Gautam is a well known name of Indian TV Channels but she debuts in this movie and guys will love her charms and sweetness. She does not portray an "Oh So Sexy" role but even then am sure guys will smile after watching her and noticing her simplicity. She can go a long way provided she chooses right roles.There are other characters that shine in this movie, including, Vicky's mom (Dolly Ahluwalia) and grand mom (Kamlesh Gill). Jayanta Das, portraying the father of Yaami Gautam, excels brilliantly.On the whole, John Abraham has managed to produce a great piece of funny and witty cinema. The movie shares a nice plot line, if we can save a dying man by donating our blood, why can't we grant our sperms to grant a whole life to someone who does not even exists in the world. The good things about this movie are that it has freshness, good humor, some great performances and a nice handling. Only drawback – it lacks star power (which these days is a must for many movie goers).Music is average, dialogues are hilarious and direction is promising." 
